{
  "approval_request_id": "apr_1",
  "interaction_id": "ix_1",
  "requested_by": {
    "actor_id": "urn:oaps:actor:agent:shopping"
  },
  "requested_from": {
    "actor_id": "urn:oaps:actor:user:efe"
  },
  "reason": "Purchase exceeds autonomous limit",
  "risk_class": "R4",
  "proposed_action": {
    "verb": "purchase",
    "target": "book:123",
    "amount": {
      "value": "42.99",
      "currency": "USD"
    }
  },
  "expires_at": "2026-04-03T12:00:00Z"
}